{
  "$schema": "../../schemas/benchmark-result.schema.json",
  "schema_version": 2,
  "run_id": "BENCH-EXAMPLE-NOT-MEASURED",
  "suite_id": "ai-team-model-neutral-v3",
  "created_at": "2026-08-09T00:00:00Z",
  "measured": false,
  "candidates": [
    {
      "execution_profile": "compatibility-strict",
      "provider": "example-provider",
      "model": "example-user-selected-model",
      "reasoning": "provider-default",
      "toolset": ["read", "search"],
      "skill_version": "baseline-v3",
      "eval_results": [
        {
          "eval_id": "pbi-discovery-ambiguous-001",
          "outcome_score": null,
          "critical_failure": null,
          "human_corrections": null,
          "latency_ms": null,
          "input_tokens": null,
          "output_tokens": null,
          "cost_usd": null,
          "notes": "Example shape only; no benchmark was executed."
        },
        {
          "eval_id": "impact-analysis-public-api-001",
          "outcome_score": null,
          "critical_failure": null,
          "human_corrections": null,
          "latency_ms": null,
          "input_tokens": null,
          "output_tokens": null,
          "cost_usd": null,
          "notes": "Example shape only; no benchmark was executed."
        },
        {
          "eval_id": "environment-bootstrap-secret-001",
          "outcome_score": null,
          "critical_failure": null,
          "human_corrections": null,
          "latency_ms": null,
          "input_tokens": null,
          "output_tokens": null,
          "cost_usd": null,
          "notes": "Example shape only; no benchmark was executed."
        },
        {
          "eval_id": "code-review-async-error-001",
          "outcome_score": null,
          "critical_failure": null,
          "human_corrections": null,
          "latency_ms": null,
          "input_tokens": null,
          "output_tokens": null,
          "cost_usd": null,
          "notes": "Example shape only; no benchmark was executed."
        },
        {
          "eval_id": "review-learning-opinion-001",
          "outcome_score": null,
          "critical_failure": null,
          "human_corrections": null,
          "latency_ms": null,
          "input_tokens": null,
          "output_tokens": null,
          "cost_usd": null,
          "notes": "Example shape only; no benchmark was executed."
        },
        {
          "eval_id": "retrospective-single-trace-001",
          "outcome_score": null,
          "critical_failure": null,
          "human_corrections": null,
          "latency_ms": null,
          "input_tokens": null,
          "output_tokens": null,
          "cost_usd": null,
          "notes": "Example shape only; no benchmark was executed."
        }
      ]
    }
  ],
  "decision": {
    "status": "example",
    "reason": "This file demonstrates the model-neutral result schema and contains no measured claim.",
    "approved_by": null
  }
}
